{
  "$schema": "http://json-schema.org/draft-07/schema#",
  "title": "SEO Site Profile",
  "description": "Site facts for one site (data only — selects and prioritises, never invents metrics). Classification (query categories incl. brand, page tags, page languages, channels incl. AI assistants, tracked keywords) lives in seo/config/rules/<domain>.json (seo/rules.py); `x-derived-from-rules` keys are computed from it by seo/site_profile.py. Consumed by skills via {{site:<key>}} tokens.",
  "type": "object",
  "required": [
    "domain"
  ],
  "additionalProperties": false,
  "properties": {
    "domain": {
      "type": "string",
      "description": "Canonical domain, e.g. pbservices.ge"
    },
    "gsc_property": {
      "type": "string",
      "pattern": "^(sc-domain:[a-z0-9.-]+|https?://[^\\s]+/)$",
      "description": "Search Console property used by seo/pipeline.py (e.g. sc-domain:example.com or https://example.com/). Unset = picked from sites_list."
    },
    "ga4_property": {
      "type": "string",
      "pattern": "^(properties/)?[0-9]+$",
      "description": "GA4 property ID used by seo/pipeline.py for GA4 pulls (e.g. 123456789)."
    },
    "priority_pages": {
      "type": "array",
      "items": {
        "type": "string"
      },
      "description": "Absolute URLs that matter most"
    },
    "markets": {
      "type": "array",
      "items": {
        "type": "string"
      },
      "description": "Target markets (ISO country codes, or the sentinel WORLDWIDE)"
    },
    "competitors": {
      "type": "array",
      "items": {
        "type": "string"
      },
      "description": "Competitor domains"
    },
    "ads_customer_id": {
      "type": "string",
      "pattern": "^[0-9]{3}-?[0-9]{3}-?[0-9]{4}$",
      "description": "Google Ads customer ID used for Keyword Planner calls"
    },
    "ads_language_constants": {
      "type": "object",
      "additionalProperties": {
        "type": "string",
        "pattern": "^languageConstants/[0-9]+$"
      },
      "description": "Language code -> Keyword Planner language resource. Verify with GAQL: SELECT language_constant.id, language_constant.code FROM language_constant"
    },
    "ads_geo_targets": {
      "type": "array",
      "maxItems": 10,
      "items": {
        "type": "string",
        "pattern": "^geoTargetConstants/[0-9]+$"
      },
      "description": "Keyword Planner geo targets (max 10); empty = all locations (use for WORLDWIDE)"
    },
    "serp_locations": {
      "type": "object",
      "additionalProperties": {
        "type": "integer"
      },
      "description": "Language code -> DataForSEO location_code for live SERP checks. Unset = ask the user which market to sample."
    },
    "thresholds": {
      "type": "object",
      "additionalProperties": false,
      "description": "Per-site overrides of seo/gsc_metrics.py and seo/ga4_metrics.py DEFAULTS (see domain-knowledge.md for meaning).",
      "properties": {
        "min_impressions": {
          "type": "number"
        },
        "mover_min_delta": {
          "type": "number"
        },
        "striking_min": {
          "type": "number"
        },
        "striking_max": {
          "type": "number"
        },
        "low_ctr_max_position": {
          "type": "number"
        },
        "low_ctr_ratio": {
          "type": "number"
        },
        "cannibal_min_share": {
          "type": "number"
        },
        "decay_pct": {
          "type": "number"
        },
        "pos_drop": {
          "type": "number"
        },
        "imp_drop_pct": {
          "type": "number"
        },
        "value_target_position": {
          "type": "integer"
        },
        "curve_min_impressions": {
          "type": "number"
        },
        "reconcile_divergence_pts": {
          "type": "number"
        },
        "not_set_share_max": {
          "type": "number"
        }
      }
    }
  },
  "x-derived-from-rules": {
    "languages": "page language codes (rules page_languages: default first)",
    "sections": "page tags (rules page_tags) plus the default tag",
    "services": "service categories (rules query categories except Brand/Generic, in category_caps order)",
    "priority_keywords": "Core tracked keywords grouped by language code"
  }
}
