{
  "domain": "pbservices.ge",
  "gsc_property": "https://pbservices.ge/",
  "ga4_property": "353738640",
  "priority_pages": [
    "https://pbservices.ge/",
    "https://pbservices.ge/about/",
    "https://pbservices.ge/services/individual-entrepreneur-georgia/",
    "https://pbservices.ge/ru/",
    "https://pbservices.ge/ru/o-nas/",
    "https://pbservices.ge/ru/uslugi/individualnyj-predprinematel/",
    "https://pbservices.ge/ar/",
    "https://pbservices.ge/ar/about-ar/",
    "https://pbservices.ge/ar/offers/individual-entrepreneur-georgia-ar/",
    "https://pbservices.ge/zh/",
    "https://pbservices.ge/zh/guanyu/",
    "https://pbservices.ge/zh/fuwu/individual-entrepreneur-georgia-zh/"
  ],
  "markets": [
    "WORLDWIDE"
  ],
  "competitors": [
    "tbilisi-expat.com",
    "register-company.ge",
    "expathub.ge",
    "gegidze.com",
    "tpsolution.ge"
  ],
  "ads_customer_id": "596-360-9731",
  "ads_language_constants": {
    "EN": "languageConstants/1000",
    "RU": "languageConstants/1031",
    "AR": "languageConstants/1019",
    "ZH": "languageConstants/1017"
  },
  "ads_geo_targets": [],
  "thresholds": {}
}
